Ross,"I’m getting married, to..day!!"
Chandler,Yeah you are!!
Ross,"Ahh, whoo-hoo!!(He runs back out the door."
Monica,Do you think he knew I was here?
Chandler,Well I’ve-I’ve never done that with you before.
Monica,Nope.
Chandler,"So, ahh, how are ya? How ya...How ya... You okay?"
Monica,"Yep, yep...You?"
Chandler,"Yes...Yes..Uh-huh, You? We did you."
Monica,Well...I’d better get going.
Chandler,"Oh yea yea, absolutely."
Monica,Could you not look?
Chandler,I don’t want to look.
Rachel,Ohhh.
Passenger,"Ahh, ahh, excuse me."
Rachel,Yeah?
Passenger,If you’re planning on doing that throughout the entire flight. Please tell me now. So that I could that a sedative...or perhaps slip you one.
Rachel,"Oh. I’m sorry. I’m very sorry. Sorry.  It’s just, I’m ahh, I’m kinda excited. I’m, ahh, going to London to ahh, tell this guy that I love him and..."
Joey,Hello?
Phoebe,"Hey, were the hell have you been?!"
Joey,Hey. I spent the night out. I met this cute bridesmaid. She is so...
Phoebe,I don’t want to hear about her!!
Joey,"Ahh Pheebs, you know you’re still my number one girl."
Phoebe,"No! No, we have an emergency. Okay? Rachel’s coming to London."
Joey,Ohh great!!!
Phoebe,"No it’s not great. No, she’s coming to tell Ross that she loves him."
Joey,"But, he loves Emily?"
Phoebe,I KNOW THAT!!! You have to stop her!! She’s going to ruin the wedding!!
Joey,Okay.
Phoebe,"All right, so, okay..."
Joey,Hold on. Hold on.  Rachel coming. Do...Something.
Phoebe,"Okay, so I’m done my part, okay. It’s your responsibility now, okay. The burden is off me, right?"
Joey,Right!
Phoebe,So tell me about this girl?
Joey,Hey.
Chandler,Hey.
Joey,Have you seen Monica?
Chandler,I’m not seeing Monica.
Joey,What?
Chandler,What?
Joey,Look we’ve got to find her. Phoebe just called!! Rachel’s coming to tell Ross she loves him!!
Chandler,Oh my god!
Joey,I know! That’s why we got to find Monica!! You know where she is?
Chandler,No!! Okay!! What’s with the third degree?! Why don’t you just shine a light in my eyes?!
Rachel,"...And so then I realized. All this stuff I had been doing. proposing to Joshua, lying to Ross about why I couldn’t come to the wedding. Was all just a way of..."
Passenger,"Oh, oh oh!! I’m sorry, can I interrupt? You know I just want to say..That you are a horrible, horrible person."
Rachel,"Ehh, pardon me?"
Passenger,"You say you love this man, yet you’re about to ruin the happiest day of his life. I’m afraid I have to agree with you friend Pheebs.. This is a..this is a...terrible, terrible plan."
Rachel,But he has to know how I feel!
Passenger,But why? He loves this...this Emily person. No good can come of this.
Rachel,Well I-I think your wrong.
Passenger,"Oh-no.And by the way, it seems to be perfectly clear that you were on a break."
Mrs. Geller,Oh my God! It’s like a fairyland.
Mrs. Waltham,"I know, it’s horrible isn’t it?"
Monica,"Well, I love it. I only hope my wedding looks this good."
Mrs. Geller,I just hope...
Monica,You can let some of them go by!
Joey,"Pisst, Monica. Alright, we really need to start looking out for Rachel. I’ll cover the front door. You watch that big hole at the back of the building and I got Chandler covering Ross."
Monica,Why would I care where Chandler is? You know uhh...You know sometimes I don’t even like Chandler.
Joey,Okay.
Ross,I do. I do. I do.
Chandler,"Oh yea, your right. It’s the second one."
Ross,Really?
Felicity,Hello Joey.
Joey,"Hey, Felicity."
Felicity,"Umm, I thought about you all day."
Joey,Yeah.
Felicity,Um-hum. Talk New York to me again.
Joey,Fuggetaboutit.  How you doin?
Felicity,Mmm.
Joey,"Oh, yeah."
Mrs. Geller,There’s nothing to discuss. We’re not paying for your wine cellar.
Mr. Waltham,You-you have to meet me in the middle here.
Mr. Geller,"Hey, you keep pushing me on this, my foots going to meet the middle of your ass."
Ross,Dad!!
Emily,What-what’s going on?!
Ross,"Nothing, nothing. Everything's under control."
Mr. Waltham,"You want a piece of me, sir? Is that what your saying?  You want a piece of me?"
Ross,"Okay! Okay! That’s it!! Parents!! Parents!! Back away!! All right, this is our wedding day! From now on everyone gets along, and if I hear one more word. NO GRANDCHILDREN!  That’s right!!"
Mr. Geller,"Okay, okay."
Mr. Waltham,"Sorry old boy, sorry. Sorry. Sorry.  I could kill you with my thumb, you know."
Emily,What was all that about?
Ross,It was...This disagreement over... My god. You...you look beautiful.
Emily,Ohh... Oh! You were not meant to see me before the wedding. It’s bad luck.
Ross,"You know what, I think we’ve had all the bad luck we’re going to have."
Ross,My God. Rachel!  Your here. I can’t believe it.  What happen? Why are you here?
Rachel,Well I just came... I just needed to tell you... Congratulations.
Mrs. Waltham,"Hello, Waltham Interiors."
Phoebe,Mrs. Waltham. Hi. It’s Phoebe again.
Mrs. Waltham,Why?!
Phoebe,"Yea. Can I please, please, please talk to one of the best men? This is going to be the last time I promise."
Mrs. Waltham,Joey there’s a girl on the phone for you.
Joey,Ohh great!!  Hello.
Phoebe,Did you stop Rachel?
Joey,"No, but it’s okay. She just came in and gave him a hug, that it."
Phoebe,So nothing got ruined?
Joey,No.
Phoebe,"Oh that’s so great! Ohh, so what’s going on now?"
Joey,"Ah, I’m-I’m walking down the aisle...Still walking.  I’m about to pass the bridesmaid I hooked up with last night.  Hey!  I told her ""Hey."" And now I’m at the front with Ross. It’s Phoebe.  He looks pretty mad. Uh...I’d better go."
Phoebe,"No!! wait, wait, wait!! Oh please, hold it up so I can listen."
Chandler,What we did last night was....
Monica,Stupid.
Chandler,Totally crazy stupid.
Monica,What were we thinking?
Chandler,"I’m coming over tonight though, right?"
Monica,Oh yeah. Definitely.
Minister,"Friends. Family. We are gathered to celebrate here today the joyous union of Ross and Emily. May the happiness we share with them today be with them always. Now Emily, repeat after me. I, Emily..."
Emily,"I, Emily..."
Minster,Take thee Ross...
Emily,Take thee Ross...
Minster,"As my lawfully wedded husband, in sickness and in health, till death parts us."
Emily,"As my lawfully wedded husband, in sickness and in health, until death parts us."
Minster,"Now Ross, repeat after me. I Ross..."
Ross,I Ross...
Minister,"Take thee, Emily..."
Ross,"Take thee, Rachel... Emily.  Emily."
Minister,Uhh...Shall I go on?
