Monica,"Guys, hurry up! The flight leaves in four hours! It could take time to get a taxi! There could be traffic! The plane could leave early! When we get to London, there could be a line at customs! Come on!!"
Chandler,Six-hour trip to London. That’s a lot of Monica.
Monica,"Passport, check!  Camera, check! Traveller’s cheques, check!"
Rachel,"Who are you saying ""check"" too?"
Monica,"Myself. Y’know for remembering to pack a thing. Yeah, you do a good thing, you get a check!  My mom does it, I never realized it was weird."
Phoebe,"Yeah, my mom used to put her head in the oven. Well, actually, she only did it the one time. But it was pretty weird."
Ross,Hey!
Monica,Hey!
Ross,Hey! Are you ready yet?
Monica,Yep! You got the tickets?
Ross,"Oh! Got ‘em right here,  check!"
Joey,"It’s all London, baby! Here we go."
Chandler,You got your passport?
Joey,"Yeah, in my third drawer on my dresser. You don’t want to lose that."
Joey,Ohh!!
Chandler,There it is.
Monica,"Okay, if you need the vacuum, it’s in my closet on the left-hand side. Ah, the garbage bags are next to the refrigerator…"
Phoebe,"Okay, okay, but Rachel’s gonna be here too, can’t I just ask her this stuff?"
Monica,"Yeah, okay, give that a try!"
Chandler,All right! Let’s do it!
Joey,Woo-hoo!!
Ross,"Yeah, cheerie-o!"
Joey,London baby!
Chandler,"Okay, ‘cause that’s not gonna get annoying."
Joey,London baby!!
Chandler,"Hey, y’know what? I was wrong."
Ross,"Well, we’re all here! I guess we should get going!"
Phoebe,"Ohhh, I wanna come over there and give you a hug and wish you luck on your wedding, but I don’t—can’t get up."
Ross,"Oh, I’ll-I’ll come hug you."
Phoebe,"Great! Yeah, could you bring me the newspaper?"
Ross,Yeah.
Phoebe,"Oh, have a great wedding!"
Ross,Thanks.
Phoebe,"Oh, hey, Chandler I wanna hug you too!"
Chandler,Hey!
Phoebe,"Oh, and great! You might as well bring me my book, it’s on the counter in your apartment."
Chandler,Oh.
Ross,"So, we’re off."
Rachel,Have fun!
Ross,"Thanks!  Ugh, I can’t believe you’re not gonna be there!"
Rachel,"Oh, I know."
Ross,So-so come! Why don’t you come?
Rachel,What?!
Ross,To London! Come to London. Please? It’ll mean so much to me.
Rachel,"Yeah, well, I gotta work, I’m sorry."
Ross,Why-why can’t you take a couple of days off?
Rachel,"Because, I can’t! Ross, I told you, no. I can’t."
Ross,This is my wedding.
Monica,"All right, y’know what? We really are late! Let’s go! Let’s go! Let’s go!!"
Ross,Fine. You’ll-you’ll watch it on video when we get back.
Chandler,Here you go Phoebe! Here you go Phobo! Phewbedo! Phaybobo.
Phoebe,Thank you.
Phoebe,Thank you.
Ross,"All right, let’s go! Bye, Pheebs!"
Joey,"Bye, Pheebs!"
Joey,London baby!!
Phoebe,"Oh, do you need a hug? You don’t have to bring me anything!"
Joey,Come on! Do something!
Chandler,"I am, I’m ignoring you."
Joey,"Okay, here!  I wanna be the on camera guy. All right, first stop, Westminster Abbey."
Chandler,"Oh, what the hell is that?"
Joey,"It’s London, baby! All right, the hotel’s here.  Wait. No, we wanna go… No. I know.  I’m gonna have to go into the map."
Chandler,"Okay, if you see a little version of me in there? Kill it!"
Joey,I got it!  Here we go.
Chandler,"Okay. Listen-listen, we’re not gonna have to walk this way the entire time are we?"
Joey,"Shhh!  Man, you made me lose it!"
Emily,"…and that was all before 10 o’clock. The caterer rang and said it was going to be Chicken Kiev instead of Chicken Tarragon. And then the florist phoned to say there aren’t any tulips. Oh, and the chilliest has carpel-tunel syndrome. We’re not gonna be…"
Ross,"Whoa-whoa-whoa! Emily,  honey, okay?"
Emily,"Well, up yours too!"
Ross,What?! No! No! That’s-that’s time-out!
Emily,Sorry.
Ross,"Sweetie, you gotta relax. Everything’s gonna be great, okay? Come on. Come on."
Monica,Chicken Kiev?
Ross,Um-hmm! Doesn’t that sound delicious at the last minute?
Monica,"Yeah, y’know, but something like salmon which would be so much more elegant than the chicken. And, you wouldn’t have to worry about the salmonella.  So, I can’t wait to see this place you’re getting married!"
Ross,"Yeah. Yeah. Yes, this place is beautiful. Emily’s parents got married here."
Emily,I still can’t believe they’re tearing it down. It really is the most lovely building you’ll ever see. I mean it’s over…  Oh my God!
Monica,It’s nice.
Emily,Oh. Oh.
Emily,Oh. Oh my God. How can this be happening? What are we going to do?
Ross,It’s all right! Everything’s gonna be all right.
Emily,How’s it gonna be all right?!
Ross,"Uh-huh, I see that."
Monica,"Okay, I talked to the guy with the shovel and I found out what happened."
Ross,What? What?
Monica,They torn it down a few days early.
Joey,"All right! Westminster Abbey! Hands down, best Abbey I’ve ever seen. Hey!  Okay. What do you think of the Abbey, Chandler?"
Chandler,"I think it’s great. It’s great. Y’know, they’re thinking of changing the name of this place."
Joey,Really? To what?
Chandler,To Put the Camera Away!!!
Joey,"Man, you are Westminster Crabby."
Phoebe,Oh. Oh.
Rachel,"Oh, honey! Don’t get up! What do you need?"
Phoebe,"Oh, no. Oh, nothing."
Rachel,Come on! I am here to take care of you! What do you need? Anything.
Phoebe,"Okay, I have a wedgie."
Rachel,"Okay, that is all you."
Phoebe,"So-so, what do you want for lunch?"
Rachel,"Oh, I don’t know. I guess we have to eat."
Phoebe,"Yeah, I do. What’s the matter?"
Rachel,I’m just bummed about the way I left things with Ross. I shouldn’t have lied to him about having to work. He seemed so mad at me.
Phoebe,"Eh, don’t be so hard on yourself. If someone I was still in love with was getting married…"
Rachel,Still in love with?!
Phoebe,Yeah!
Rachel,I’m not in love with Ross!
Phoebe,"Oh. No. No. Good! Yeah, me neither."
Rachel,"Phoebe, I’m going to Ross’s wedding because he is my ex-boyfriend and that would be really uncomfortable. Not because, I’m still in love with him! I mean, hey, y’know, I like Ross as much as the next guy, y’know? Clearly I have feelings for him, but feelings don’t mean love! I mean, I still have loving feelings for Ross. Yeah! But, I have, I have continuing feelings of love, but that doesn’t mean that-that I’m still in love with him. Y’know? I-I have sexual feelings for him, but I do love him—Ohh! Oh my God! Oh my—why didn’t you tell me?!!"
Phoebe,We thought you knew!
Rachel,We?!
Phoebe,"Yeah, we all know! We talk about it all the time!"
Rachel,You all know? Does Ross know?
Phoebe,"Oh no, Ross doesn’t know anything."
Rachel,"Oh, I can not believe you didn’t tell me!"
Phoebe,"Well, because we thought you knew!! It’s so obvious! God, that would be like telling Monica, ""Hey, you like things clean."""
Joey,Hey!
The Vendor,"So, what are you guys in the market for? We’ve got uh, scarves, tulip post cards..."
Joey,Check this out? Huh?  Yeah. That’s the stuff. What do you think?
Chandler,"Well, I don’t have to buy that, ""I’m with stupid"" T-shirt anymore."
Joey,"Well, I like it. Here you go."
Chandler,"All right, look, you’re not really gonna buy that are you? Don’t you think you’ve embarrassed me enough for one day?"
Joey,"Oh, I embarrass you?"
Chandler,How can I answer that when I’m pretending I don’t know you?
The Vendor,He’s just jealous. You’ll fit right in; all Londoners wear them!
Chandler,Oh really? Then how come no one here is wearing them?
The Vendor,They’re all tourists.
Chandler,"All right, look, if you insist on wearing that, in public, y’know, you’re gonna spend the rest of the afternoon all by yourself."
Joey,Oh yeah?  If you’re gonna make me choose between you and the hat? I choose the hat.
The Vendor,Good choice.
Joey,Thanks.
Chandler,"Okay, wait. All right, that’s it, okay, I’m out of here. I am not going to be embarrassed anymore!"
Emily,Hello?
Ross,"Hey! I just spoke to your dad, and you know what? He seems to think we’ll be able to find a new place for the wedding."
Emily,We don’t have to.
Ross,Whoa-whoa-what? You found a place?
Emily,"No. But, Monica and I were talking, and-and I was so upset about the hall being knocked down, and she suggested that we put the wedding off for a bit."
Ross,She said what?
Emily,"She said, ""If I’m not gonna be happy getting married somewhere that we find in a day, well then we should just postpone it."""
Ross,"Postpone it? Emily, do you think Monica realises how much our parents spent on this wedding? Do you my sister’s teeny-tiny little brain comprehends that people took time out of their lives to fly thousands of miles to be here, huh?  This isn’t right."
Emily,"I realize that people are going to be disappointed. But, I’m sure they’ll come back when we can do it right."
Ross,I can’t ask people to do that? Would you ask people to do that?
Emily,"Don’t you point your pants at me!  We have no choice! Anywhere that’s half-decent would’ve be booked months ago, Ross don’t you understand? This is our wedding I’m talking about."
Ross,The only thing I understand is; postponing it is not an option. This is when we’re getting married.
Emily,So what are you saying? It’s now or never?
Ross,No. I’m saying it’s now.
Emily,Or?
Ross,There’s no ‘or’ in mind. What is wrong with these pants?!!
Emily,"It’s not the pants. It’s you that is backwards. And if, and if you don’t understand how important this is to me, well then, perhaps we shouldn’t get married at all!"
Ross,"No, wait! Emily! No, wait, stop! Emily, please—"
Phoebe,Hey!
Rachel,Hi.
Phoebe,"So, did shopping make you feel any better about Ross?"
Rachel,Manhattan does not have enough stores.
Phoebe,"Well, I think I can help you get over him."
Rachel,You can?
Phoebe,Yeah. I just need you to bring me some photos of Ross.
Rachel,Um-hmm.
Phoebe,And a small piece of chocolate.
Rachel,Okay.
Phoebe,And a glass of tepid water.
Rachel,"Ooh, is this one of those things where you throw it in a bag with some graveyard dirt and hang it from a north-facing tree?"
Phoebe,"Uh, only if you have the hiccups too. Yeah, the pictures are for you, the water and the chocolate is for me. I just didn’t feel like getting up. Okay, I’m gonna show you a picture of Ross. Okay? And you’re going to remember all of the bad things about him. All right? Really focus on his flaws."
Rachel,I can do that. I certainly did it when we were going out.
Phoebe,"Okay. Umm, before we get started, I just wanna say for the record that I love Ross, I think he’s such a great guy. Here.  Okay, now, close your eyes. And imagine that you’re with Ross okay and imagine that you’re kissing him. And you’re-you’re running your hands all over his body. And then you run your hands through his hair, but eew-oh gross it’s some kind of grease, it’s—uck! Hah?"
Rachel,"I don’t know, his uh, his hair never really bothered me that much, and y’know it was always more crunchy than it was greasy."
Phoebe,"Okay, this is going to be harder than I thought. Umm, let’s try some uh, aversion therapy."
Rachel,Okay.
Phoebe,Okay?
Rachel,All right.
Phoebe,"So uh, now look at the picture…"
Rachel,Okay.
Phoebe,"All right, and umm…"
Rachel,Ow!
Phoebe,"Okay, how do you feel now?"
Rachel,"Well, I like you less!"
Joey,Hey.
Chandler,Hey.
Joey,Oh.  Sorry!
Chandler,"No-no-no, y’know what? I really shouldn’t have said that you were embarrassing me, I mean that really wasn’t cool. And if it makes you feel any better, I’ve had a really lousy day."
Joey,Me too.
Chandler,Yeah?
Joey,"Noo!! I’ve had the best day ever! Dude, check this out!"
Monica,Hey!
Joey,Sh-shh-shh!
Joey,"Okay, so say hi to my friend and tell him that you like the hat."
Fergie,"Okay, so umm, what’s your friend’s name?"
Joey,"Oh, Chandler."
Fergie,Hi Chandler!
Chandler,That’s… That’s was…
Monica,Oh my God!
Joey,That’s Fergie baby!!
Fergie,"Joey says you don’t really like his hat, but I think it’s kinda dashing."
Chandler,How did you? How? How?
Joey,"Well, I was trying to figure out how to get to Buckingham Palace, right? So, I’m in my map and-and… Hey!"
Monica,Hey!
Ross,Hi. I understand you had a little talk with Emily.
Monica,"Yes, I did! And you are welcome!"
Ross,Am I?! And was it your idea to postpone the wedding?!
Monica,Umm…
Chandler,I’m gonna go to the bathroom.
Joey,Wait up!
Ross,"Hey-hey, since you’re the ‘fix-it’ lady, here’s a pickle, what do you do when the bride says she doesn’t want to have the wedding at all?"
Monica,She said that?!
Ross,Yeah.
Monica,Why?!
Ross,"I don’t know, I told her it was stupid to put off the wedding just because the hall was gone and she liked flipped out."
Monica,Oh my God. You’re even dumber than I am!
Ross,Excuse me?
Monica,"Ross, how long have you been planning this wedding?"
Ross,I don’t know. A month?
Monica,"Emily has probably been planning it since she was five! Ever since the first time she took a pillowcase and hung it off the back of her head. That’s what we did! We dreamed about the perfect wedding, and the perfect place, with the perfect four-tiered wedding cake , with the little people on top.  Thanks. But the most important part is that we had the perfect guy who understood just how important all that other stuff was."
Ross,"I had no idea. And that-that pillowcase thing, I thought you guys were just doing the flying nun."
Monica,Sometimes we were.
Ross,Come on. You gotta help me figure out what to do. Okay?
Monica,Okay.
Ross,Come on.
Chandler,That was pretty intense huh?
Joey,"Yeah.  Hey, I hope Ross didn’t think that we just went in there because we were uncomfortable being out here!"
Chandler,I hope he did!
Phoebe,Hello.
Joey,"Hey, Pheebs! It’s Joey!"
Phoebe,"Hey, Joey! Hey! Ooh! Ooh! I just say someone on the—that looks just like you on the subway. And I was gonna go over and say ‘hi!’ but then I figured, he doesn’t care if he looks like you."
Joey,"That just cost me four bucks. But uh listen, I just called to see how the chick and the duck are doing?"
Phoebe,"Ohh, they’re having a great time with their Aunt Phoebe! Aunt Rachel hasn’t been helpful at all. So, do you miss me?"
Joey,"Kinda, but I’ve just been having way too much fun."
Phoebe,So you’re not homesick yet?
Joey,"No, I don’t think so."
Phoebe,"All right, the seven of us miss you."
Joey,Who’s seven?
Phoebe,"Y’know, me, Rachel, the birds, the babies…"
Joey,"Ahh, the babies miss me?"
Phoebe,"Ooh, the pizza guy’s here!"
Joey,What? You ordered pizza without me?!
Phoebe,"Yeah. But y’know we were thinking about you, y’know we ordered the Joey Special."
Joey,Two pizzas?!
Phoebe,"Yep! Okay, gotta go, talk to you later."
Joey,"Wait, well, where did you get it from?!"
Emily,"Monica, why have you brought me here of all places?!"
Monica,You’ll see.
Emily,"I tell you, this wedding is not going to happen."
Emily,Oh God.
Ross,"Okay? But-but imagine a lot more lights, okay? And-and y’know fewer bricks, and-and-and flowers, and candles…"
Monica,"And the musicians, look, they can go over here , okay? And the chairs can face this way , and…  You go."
Ross,"But-but, if you don’t love this, we’ll do it in any other place at any other time. Really, it’s fine, whatever you want."
Emily,It’s perfect.
Ross,"And, I don’t know, if it starts to rain…"
Emily,Well then we’ll get wet.
Monica,Ohh. And I don’t even have a date.
Rachel,Pheebs?
Phoebe,Yeah?
Rachel,Do you remember where the duck food is?
Phoebe,"Yeah, it’s in the guys’ apartment under the sink. Why?"
Rachel,Because I’m going to London.
Phoebe,What?! What do you mean you’re going to London?
Rachel,"Yeah, I have to tell Ross that I love him. Now honey, you take care, you don’t have those babies until I get back."
Phoebe,"I—Rachel, you can’t go! Ross loves Emily!"
Rachel,"Yeah, I know, I know, I know he does. But I have to tell him how I feel! He deserves to have all the information and then he can make an informed decision."
Phoebe,"That’s not why you’re going! You’re going because you hope he’s gonna say, ""Yeah, I love you too, Rach. Forget that British chippy."""
Rachel,Ohh—Do you think he will?!
Phoebe,"No! Because he’s in love with the British chippy! Look, Rachel, if you go, you’re just gonna mess with his head and ruin his wedding! Y’know, it’s too late! You missed you’re chance! I’m sorry, I know this must be really hard, it’s over."
Rachel,"Y’know what? No. It’s not over until someone says, ""I do."""
Phoebe,"I do! I do! I do!  I do!  Ugh, like I can really chase you. I’m carrying a litter."
Housekeeper,The Waltham Residence.
Phoebe,Oh...yes..is this..umm..Emily’s Parents’ house.
Housekeeper,"This is the housekeeper speaking. And by the way, young lady, that is not how one addresses oneself on the telephone. First one identifies oneself and then asks for the person with whom one wishes to speak."
Phoebe,"This is Phoebe Buffay. I was wondering, please, if-if it’s not too much trouble, please, umm, might I speak to Miss Emily Waltham, please?"
Housekeeper,"Miss Waltham, is at the rehearsal dinner and it’s not polite to make fun of people. Goodbye."
Phoebe,"No no no, I’ll be nice, I swear!!! Could you just give me the number for where they are?"
Housekeeper,"I’m afraid, I’m not at liberty to divulge that information."
Phoebe,"Ok, somebody is on their way to ruin wedding okay. And I have to warn somebody, alright. So if you don’t give me that number then I’m going to come over there and kick your snooty ass all the way to New Glocken..shire."
Housekeeper,Hangs up.
Phoebe,"Hello, Hello. Ohh, OHH, she knew I could kick her ass."
Monica,Hey.
Ross,Hi. Mom. Dad.
Mrs. Geller,"Sweetheart. Oh sorry were late, my fault, I insisted on riding the tube."
Mr. Geller,"Judy, the kids.."
Mrs. Geller,"Jack, that’s what they call the subway."
Mr. Geller,"Ohh, I thought that you...."
Ross and Monica,"Dad, dad. We got it!! We Got It!!!"
Emily,"Ohh, here comes my dad and stepmum. Mister and Misses Geller, this is Steven and Andrea Waltham."
Mr. Waltham,"Hello. Hello. How do you do? How do you do? Very nice to meet you.  Darling it’s the Gellers.   Darling, it’s the Gellers.  She’s very self-absorbed, you know. I should never have married her."
Mrs. Waltham,"Sorry, what?"
Mr. Waltham,It’s the Gellers!
Mrs. Waltham,Where?
Mr. Waltham,Well there’s one  and there’s another .
Mrs. Waltham,Lovely to meet you.
Mr. Waltham,Terribly nice of you to offer to pay for half the wedding.
Mr. Geller,"Ohh forget it. Too hell with tradition, we’re happy to do it."
Mrs. Geller,"We know how expensive weddings can be, besides this may be the only wedding we get to throw ."
Monica,"Ha ha, a joke that’s funny in all countries."
Waiter,Sir?
Joey,What’s in it?
Waiter,"Goat cheese, water chestnuts, and panchetta."
Joey,"That’s not food...No, I don’t, no... Everything's different here...I want to go home. I...I miss my family. I miss the coffee house. I can’t even remember what Phoebe looks like."
Chandler,"Joey, it’s been three days, okay.. Your just a little homesick, Okay. Would you just try to relax. Just, just try to enjoy yourself."
Joey,Your different here too. Your mean in England.
Mr. Geller,What the hell!!!
Ross,"what’s up, Dad?"
Mr. Geller,This bill for my half of the wedding. it’s insane.
Mrs. Geller,How could it be so much? The receptions at their house.
Mr. Geller,"Flowers, liquor, recarpet first floor. New guest bath, landscaping. I’m paying to remodel this guys house.  I’m going to give that son on a bitch, a piece of my mind."
Ross,"Dad, dad, please. Look I don’t want anything to upset Emily tonight. Alright, she's had a hard enough couple of days as it is.  Now here, here, let me go talk to him, okay?"
Mr. Geller,And you tell him no one takes advantage of the Gellers.
Mrs. Geller,"Ooh, Jack.... Sometimes I forget how powerful you can be."
Monica,And I’m going to go get drunk.
Rachel,"Ooh, ooh, ooh,ooh,ooh.  Hi."
Ticket Agent,Hello.
Rachel,"Hello. Umm, when is your next flight to London?"
Ticket Agent,There’s one leaving in thirty minutes.
Rachel,"Ohh, good."
Ticket Agent,And I do have one seat left.
Rachel,"Ohh, thank you, thank you, thank you."
Ticket Agent,The last minute fare on this ticket is twenty seven hundred dollars.
Rachel,"Ohh, I just don’t think I have enough left on my credit card."
Ticket Agent,Well you can split it with another credit card.
Rachel,"Ohh, okay, how about five.  Ohh, thank you."
Ticket Agent,I’m just going to need to see your passport.
Rachel,"Okay, you know what? I don’t have it, but I can tell you exactly where it is on my night stand, and...okay. But you know what? I have my drivers license and I have a twenty."
Ticket Agent,
Ross,"Look, face it, my father is not going to pay for the build-in barbecue and believe me you can kiss you gazebo goodbye. Now I might be able to get you the new lawn."
Mr. Waltham,"Ahh, then you have to give us the lawn ornaments."
Ross,"I go back there with lawn ornaments, he’s going to laugh in my face."
Mrs. Waltham,"This is ridiculous. I mean we had an agreement.  Will you say something, Steven?! Please!!!"
Mr. Waltham,Don’t take that tone with me.  All-all right you can.
Rachel,"Hi, Pheebs."
Phoebe,"Oh thank god. Oh, you changed your mind. Oh, look I know you probably want to be alone, and you don’t want to talk about it, that’s fine. I just want you to know, I think you are doing the right thing and..."
Rachel,"Bye, Pheebs."
Phoebe,Wait!! Where are you going?! What are you doing?! No!! Wait!!  God!! Why am I always pregnant when she does that?!
Chandler,"I’d like to toast, Ross and Emily. Of course, my big toast will be tomorrow at the wedding, so this is kind of my little toast or Melba toast, if you will.  Okay. I known Ross for a long time. In fact, I knew him when he was going out with his first girlfriend.  And I thought things were going to work out for him..Until the day he over inflated her.  Ohh, Dear God.."
Mrs. Waltham,"Hello, Waltham Interiors."
Phoebe,"Oh, hi, Mrs. Waltham. I need to speak with ether one of the best men, or Ross’s sister Monica."
Mrs. Waltham,Who is this?
Phoebe,"Oh, I’m Phoebe Buffay. I’m one of Ross’s best friends."
Mrs. Waltham,"Well, if you’re on e of Ross’s best friends, why aren’t you here?"
Phoebe,"Yeah, um, I can’t fly. I’m having my brother’s babies."
Mrs. Waltham,"Oh, am I on the radio?"
Phoebe,"No..umm, could I talk to one of them? It’s very very important."
Mrs. Waltham,"No, I’m bored with you now. I’m going to cut you off."
Phoebe,"Ohh! Okay, I’m going to have to kick her ass too."
Chandler,"And I’m sure we’re all very excited that Ross and Emily are getting married at Montgomery Hall. I mean to think, my friend getting married in Monty Hall.  Ohh, come on!! Monty Hall!! Lets make a Deal!! Come on, you people!! All right, forget it!! Congratulations, Ross and Emily."
Joey,"Hey, best man number two, Joey Tribbiani. Now I’m not good with the jokes like Chandler here. Boy...but ahh, I just want to say congratulation to the happy couple. I first met Ross in this coffee house back home...Home...New York City...Where everybody knows my name. Well anyway, I love you guys.  But not as much as I love America.  Could we please..go home now?"
Felicity,Are you going home? I was hoping to get to know you better.
Joey,"I’m not going anywhere, sweetheart."
Monica,I was laughing.
Chandler,Out loud?
Monica,Well I didn’t want everyone to think I was stupid.
Chandler,So how are you doing?
Monica,"My mother’s driving me crazy, but Ross is getting married. I’m happy.  I’m not going to let anything spoil that."
Drunk Man,I just want to say that Ross is a wonderful young man.
Monica,"Well, thanks, we like him."
Drunk Man,My god!! You must have been a teenage when you had him.
Mr. Geller,"There’s no way in hell, I’m paying for it."
Ross,"Look, were down to just one point. Could we please, maybe just settle it after the wedding."
Mr. Geller,"All-right fine, but I just want to say, I’m not paying for your wine cellar. You thieving, would be speaking German if it weren’t for us, cheap little man."
Chandler,"The guy was hammered, okay? There’s no way, you look like Ross’s mother."
Monica,Then why would he say it?
Chandler,Because he’s crazy. Okay? He came up to me earlier and thanked me for my very moving performance in Titanic.
Monica,"Oh, my mother’s right. I’m never going to get married."
Chandler,"Ahh, you know what? That is....Who wouldn’t want you?"
Monica,"Ohh, Please?! I’m a single mom, with a thirty year old son!!"
Rachel,"Hi, I’m back. Listen, I need to..."
Ticket Agent,Hello.
Rachel,Hello. I need to get on the 11 o'clock flight.
Ticket Agent,Oh I’m afraid that plane has already pulled away from the gate.
Rachel,"Okay, you know what/ You’re going to have to call that plane and tell them to swing around and come and pick me up."
Ticket Agent,I can’t do that.
Rachel,"Sure, you know what? Come on, we’ll just tell them that there was like a problem with like the ""engine""."
Ticket Agent,"I’m afraid I’m going to have to ask you to step aside, Miss."
Rachel,"Look, If I don’t get to London!! He is going to marry that other girl!!!"
Ticket Agent,I can’t imagine why.
Rachel,"All right, you know what? I am not leaving here, until you call that plane back!!"
Ross,I’m getting married today!! Whoo-hoo!!
Chandler,"Morning, Ross."
